{"isin":"US5528481030","name":"MGIC Investment Corporation","primary":{"market":"US","ticker":"MTG","exchange":"NYSE","status":"listed","url":"https://cdn.jsdelivr.net/gh/MrChartist/global-stock-logos@main/api/v1/companies/us/MTG.json"},"others":[{"market":"GERMANY","ticker":"882538","exchange":"LSX","status":"listed","url":"https://cdn.jsdelivr.net/gh/MrChartist/global-stock-logos@main/api/v1/companies/germany/882538.json"}]}