{"isin":"BRCINFBDR000","name":"Cincinnati Financial Corp Shs Unsponsored Brazilian Depository Receipt Repr 1/2 Sh","primary":{"market":"BRAZIL","ticker":"CINF34","exchange":"BMFBOVESPA","status":"listed","url":"https://cdn.jsdelivr.net/gh/MrChartist/global-stock-logos@main/api/v1/companies/brazil/CINF34.json"},"others":[]}