{"isin":"FR0000053381","name":"Derichebourg SA","primary":{"market":"FRANCE","ticker":"DBG","exchange":"EURONEXT","status":"listed","url":"https://cdn.jsdelivr.net/gh/MrChartist/global-stock-logos@main/api/v1/companies/france/DBG.json"},"others":[{"market":"UK","ticker":"0K8W","exchange":"LSIN","status":"listed","url":"https://cdn.jsdelivr.net/gh/MrChartist/global-stock-logos@main/api/v1/companies/uk/0K8W.json"},{"market":"GERMANY","ticker":"893619","exchange":"LSX","status":"listed","url":"https://cdn.jsdelivr.net/gh/MrChartist/global-stock-logos@main/api/v1/companies/germany/893619.json"}]}