{"isin":"FR0011950732","name":"Elior Group SA","primary":{"market":"FRANCE","ticker":"ELIOR","exchange":"EURONEXT","status":"listed","url":"https://cdn.jsdelivr.net/gh/MrChartist/global-stock-logos@main/api/v1/companies/france/ELIOR.json"},"others":[{"market":"UK","ticker":"0QVP","exchange":"LSIN","status":"listed","url":"https://cdn.jsdelivr.net/gh/MrChartist/global-stock-logos@main/api/v1/companies/uk/0QVP.json"},{"market":"GERMANY","ticker":"A115FW","exchange":"LS","status":"listed","url":"https://cdn.jsdelivr.net/gh/MrChartist/global-stock-logos@main/api/v1/companies/germany/A115FW.json"}]}