{"isin":"US0028962076","name":"Abercrombie & Fitch Co. Class A","primary":{"market":"US","ticker":"ANF","exchange":"NYSE","status":"listed","url":"https://cdn.jsdelivr.net/gh/MrChartist/global-stock-logos@main/api/v1/companies/us/ANF.json"},"others":[{"market":"MEXICO","ticker":"ANF","exchange":"BMV","status":"listed","url":"https://cdn.jsdelivr.net/gh/MrChartist/global-stock-logos@main/api/v1/companies/mexico/ANF.json"},{"market":"UK","ticker":"0R32","exchange":"LSE","status":"listed","url":"https://cdn.jsdelivr.net/gh/MrChartist/global-stock-logos@main/api/v1/companies/uk/0R32.json"},{"market":"GERMANY","ticker":"AFT","exchange":"HAN","status":"listed","url":"https://cdn.jsdelivr.net/gh/MrChartist/global-stock-logos@main/api/v1/companies/germany/AFT.json"},{"market":"ITALY","ticker":"1ANF","exchange":"MIL","status":"listed","url":"https://cdn.jsdelivr.net/gh/MrChartist/global-stock-logos@main/api/v1/companies/italy/1ANF.json"}]}