{"isin":"AU0000384935","name":"Canadian Phosphate Limited","primary":{"market":"AUSTRALIA","ticker":"CP8","exchange":"ASX","status":"listed","url":"https://cdn.jsdelivr.net/gh/MrChartist/global-stock-logos@main/api/v1/companies/australia/CP8.json"},"others":[{"market":"US","ticker":"CPHOF","exchange":"OTC","status":"listed","url":"https://cdn.jsdelivr.net/gh/MrChartist/global-stock-logos@main/api/v1/companies/us/CPHOF.json"}]}