{"isin":"CA22289D1078","name":"Coveo Solutions, Inc.","primary":{"market":"CANADA","ticker":"CVO","exchange":"TSX","status":"listed","url":"https://cdn.jsdelivr.net/gh/MrChartist/global-stock-logos@main/api/v1/companies/canada/CVO.json"},"others":[{"market":"US","ticker":"CVOSF","exchange":"OTC","status":"listed","url":"https://cdn.jsdelivr.net/gh/MrChartist/global-stock-logos@main/api/v1/companies/us/CVOSF.json"}]}