{"isin":"AU000000BIT4","name":"Biotron Limited","primary":{"market":"AUSTRALIA","ticker":"BIT","exchange":"ASX","status":"listed","url":"https://cdn.jsdelivr.net/gh/MrChartist/global-stock-logos@main/api/v1/companies/australia/BIT.json"},"others":[{"market":"US","ticker":"BITRF","exchange":"OTC","status":"listed","url":"https://cdn.jsdelivr.net/gh/MrChartist/global-stock-logos@main/api/v1/companies/us/BITRF.json"}]}