{"isin":"BRBEMCBDR000","name":"iShares MSCI Emerging Markets ex China ETF Shs Unsponsored Brazilian Depositary Receipt Repr 0.2 Sh","primary":{"market":"BRAZIL","ticker":"BEMC39","exchange":"BMFBOVESPA","status":"listed","url":"https://cdn.jsdelivr.net/gh/MrChartist/global-stock-logos@main/api/v1/companies/brazil/BEMC39.json"},"others":[]}