{"isin":"CA4882951060","name":"Kelt Exploration Ltd.","primary":{"market":"CANADA","ticker":"KEL","exchange":"TSX","status":"listed","url":"https://cdn.jsdelivr.net/gh/MrChartist/global-stock-logos@main/api/v1/companies/canada/KEL.json"},"others":[{"market":"GERMANY","ticker":"2KE","exchange":"GETTEX","status":"listed","url":"https://cdn.jsdelivr.net/gh/MrChartist/global-stock-logos@main/api/v1/companies/germany/2KE.json"},{"market":"US","ticker":"KELTF","exchange":"OTC","status":"listed","url":"https://cdn.jsdelivr.net/gh/MrChartist/global-stock-logos@main/api/v1/companies/us/KELTF.json"}]}