{"isin":"CA87190J1057","name":"TDG Gold Corp","primary":{"market":"CANADA","ticker":"TDG","exchange":"NEO","status":"listed","url":"https://cdn.jsdelivr.net/gh/MrChartist/global-stock-logos@main/api/v1/companies/canada/TDG.json"},"others":[{"market":"US","ticker":"TDGGF","exchange":"OTC","status":"listed","url":"https://cdn.jsdelivr.net/gh/MrChartist/global-stock-logos@main/api/v1/companies/us/TDGGF.json"},{"market":"GERMANY","ticker":"34M","exchange":"GETTEX","status":"listed","url":"https://cdn.jsdelivr.net/gh/MrChartist/global-stock-logos@main/api/v1/companies/germany/34M.json"}]}