{"isin":"SE0016829824","name":"Qlucore AB","primary":{"market":"SWEDEN","ticker":"QCORE","exchange":"OMXSTO","status":"listed","url":"https://cdn.jsdelivr.net/gh/MrChartist/global-stock-logos@main/api/v1/companies/sweden/QCORE.json"},"others":[{"market":"GERMANY","ticker":"5QO","exchange":"GETTEX","status":"listed","url":"https://cdn.jsdelivr.net/gh/MrChartist/global-stock-logos@main/api/v1/companies/germany/5QO.json"}]}