{"isin":"PLBH00000012","name":"Bank Handlowy w Warszawie S.A.","primary":{"market":"POLAND","ticker":"BHW","exchange":"GPW","status":"listed","url":"https://cdn.jsdelivr.net/gh/MrChartist/global-stock-logos@main/api/v1/companies/poland/BHW.json"},"others":[{"market":"GERMANY","ticker":"6HW","exchange":"GETTEX","status":"listed","url":"https://cdn.jsdelivr.net/gh/MrChartist/global-stock-logos@main/api/v1/companies/germany/6HW.json"}]}