{"isin":"BRA1THBDR008","name":"Autohome Inc. ADR Unsponsored Brazilian Depositary Receipt Repr 0.1 ADR","primary":{"market":"BRAZIL","ticker":"A1TH34","exchange":"BMFBOVESPA","status":"listed","url":"https://cdn.jsdelivr.net/gh/MrChartist/global-stock-logos@main/api/v1/companies/brazil/A1TH34.json"},"others":[]}