{"isin":"CA45823T1066","name":"Intact Financial Corporation","primary":{"market":"CANADA","ticker":"IFC","exchange":"NEO","status":"listed","url":"https://cdn.jsdelivr.net/gh/MrChartist/global-stock-logos@main/api/v1/companies/canada/IFC.json"},"others":[{"market":"MEXICO","ticker":"IFCN","exchange":"BMV","status":"listed","url":"https://cdn.jsdelivr.net/gh/MrChartist/global-stock-logos@main/api/v1/companies/mexico/IFCN.json"},{"market":"GERMANY","ticker":"I5U","exchange":"GETTEX","status":"listed","url":"https://cdn.jsdelivr.net/gh/MrChartist/global-stock-logos@main/api/v1/companies/germany/I5U.json"},{"market":"US","ticker":"IFCZF","exchange":"OTC","status":"listed","url":"https://cdn.jsdelivr.net/gh/MrChartist/global-stock-logos@main/api/v1/companies/us/IFCZF.json"}]}