{"isin":"CA68277V1040","name":"Ongold Resources Ltd","primary":{"market":"CANADA","ticker":"ONAU","exchange":"TSXV","status":"listed","url":"https://cdn.jsdelivr.net/gh/MrChartist/global-stock-logos@main/api/v1/companies/canada/ONAU.json"},"others":[{"market":"US","ticker":"ONGRF","exchange":"OTC","status":"listed","url":"https://cdn.jsdelivr.net/gh/MrChartist/global-stock-logos@main/api/v1/companies/us/ONGRF.json"}]}